{"type": "config", "constrained_file": "strategy/meta_controller.py", "constrained_lines": [44], "tunables": {"discount": {"current": 0.995, "bounds": [0.90, 1.0]}}, "eval_command": "venv/bin/python3 scripts/meta_discount_eval.py", "metric": "SCORE (cumulative pnl_pct over matched events from offline contextual-bandit replay, deterministic with seed=0)", "guard_metric": "MATCH_RATE", "guard_threshold": 0.20, "implicit_guard": "MATCH_RATE < floor -> eval prints SCORE: -inf -> hard discard", "min_delta": 5.0, "baseline": 497.8990, "baseline_match_rate": 0.5810, "baseline_runs": 3, "baseline_variance": 0.0, "lookback_days": 14, "n_events_baseline": 2606, "max_iterations": 30, "early_stop": "5 consecutive non-improvements"}
{"type": "result", "iteration": 0, "values": {"discount": 0.995}, "score": 497.8990, "delta": "+0.0000", "guard_score": 0.5810, "guard_pass": true, "status": "baseline", "description": "Frozen baseline (3-run stability check, zero variance)", "timestamp": "2026-04-24T22:45:00Z"}
{"type": "result", "iteration": 1, "values": {"discount": 0.999}, "score": 457.2700, "delta": "-40.6290", "guard_score": 0.7728, "guard_pass": true, "status": "discard", "description": "Near-no-decay: match rate up sharply but SCORE dropped ~40; slow forgetting hurts adaptation", "timestamp": "2026-04-24T22:46:00Z"}
{"type": "result", "iteration": 2, "values": {"discount": 0.99}, "score": 517.2590, "delta": "+19.3600", "guard_score": 0.6324, "guard_pass": true, "status": "keep", "description": "Faster forgetting (γ=0.99) lifts SCORE ~19 over baseline; match rate rises modestly", "timestamp": "2026-04-24T22:46:30Z"}
{"type": "result", "iteration": 3, "values": {"discount": 0.97}, "score": 247.5220, "delta": "-250.3770", "guard_score": 0.6857, "guard_pass": true, "status": "discard", "description": "Too-aggressive decay at γ=0.97 craters SCORE (~half); posterior forgets too fast", "timestamp": "2026-04-24T22:47:00Z"}
{"type": "result", "iteration": 4, "values": {"discount": 0.95}, "score": -85.2200, "delta": "-583.1190", "guard_score": 0.5203, "guard_pass": true, "status": "discard", "description": "γ=0.95 goes negative; matches pre-launch probe result — too much forgetting", "timestamp": "2026-04-24T22:47:30Z"}
{"type": "result", "iteration": 5, "values": {"discount": 0.992}, "score": 487.0160, "delta": "-30.2430", "guard_score": 0.6577, "guard_pass": true, "status": "discard", "description": "γ=0.992 between baseline and best; does not beat best 0.99", "timestamp": "2026-04-24T22:48:00Z"}
{"type": "result", "iteration": 6, "values": {"discount": 0.985}, "score": 394.4110, "delta": "-122.8480", "guard_score": 0.6025, "guard_pass": true, "status": "discard", "description": "γ=0.985 noticeably below best; curve drops sharply below 0.99", "timestamp": "2026-04-24T22:48:30Z"}
{"type": "result", "iteration": 7, "values": {"discount": 0.988}, "score": 463.7450, "delta": "-53.5140", "guard_score": 0.5975, "guard_pass": true, "status": "discard", "description": "γ=0.988 in valley; best remains at 0.99", "timestamp": "2026-04-24T22:49:00Z"}
{"type": "result", "iteration": 8, "values": {"discount": 0.991}, "score": 532.9050, "delta": "+15.6460", "guard_score": 0.5729, "guard_pass": true, "status": "keep", "description": "γ=0.991 beats 0.99 by ~16; tight band between 0.99 and 0.992 favors middle", "timestamp": "2026-04-24T22:49:30Z"}
{"type": "result", "iteration": 9, "values": {"discount": 0.9915}, "score": 398.6850, "delta": "-134.2200", "guard_score": 0.6685, "guard_pass": true, "status": "discard", "description": "γ=0.9915 collapses SCORE; landscape is jagged at fine scale (RNG chaos with same seed)", "timestamp": "2026-04-24T22:50:00Z"}
{"type": "result", "iteration": 10, "values": {"discount": 0.9905}, "score": 520.2210, "delta": "-12.6840", "guard_score": 0.6523, "guard_pass": true, "status": "discard", "description": "γ=0.9905 decent (above baseline) but below best 0.991", "timestamp": "2026-04-24T22:50:30Z"}
{"type": "result", "iteration": 11, "values": {"discount": 0.9912}, "score": 532.3200, "delta": "-0.5850", "guard_score": 0.6715, "guard_pass": true, "status": "discard", "description": "γ=0.9912 essentially ties best (within min-delta); confirms 0.991 neighborhood is peak", "timestamp": "2026-04-24T22:51:00Z"}
{"type": "result", "iteration": 12, "values": {"discount": 0.9908}, "score": 430.7890, "delta": "-102.1160", "guard_score": 0.6120, "guard_pass": true, "status": "discard", "description": "γ=0.9908 in valley; jagged landscape confirmed", "timestamp": "2026-04-24T22:51:30Z"}
{"type": "result", "iteration": 13, "values": {"discount": 0.993}, "score": 425.1360, "delta": "-107.7690", "guard_score": 0.5134, "guard_pass": true, "status": "discard", "description": "γ=0.993 drops below baseline; peak is narrow around 0.991", "timestamp": "2026-04-24T22:52:00Z"}
{"type": "result", "iteration": 14, "values": {"discount": 0.9911}, "score": 532.5550, "delta": "-0.3500", "guard_score": 0.6846, "guard_pass": true, "status": "discard", "description": "γ=0.9911 matches best within noise; tight plateau at [0.991, 0.9912]", "timestamp": "2026-04-24T22:52:30Z"}
